{
  "$schema": "https://json-schema.org/draft/2020-12/schema",
  "$id": "https://openclaw.ai/schemas/clawtune/clause-telemetry.schema.json",
  "title": "eBPF clause telemetry artifact",
  "type": "object",
  "required": [
    "version",
    "schema",
    "mode",
    "status_model",
    "calls",
    "telemetry_quality",
    "collection_validity"
  ],
  "properties": {
    "schema": {"const": "clause_telemetry_v2", "description": "Artifact protocol discriminator."},
    "version": {"const": 2, "description": "Clause telemetry artifact version."},
    "mode": {"const": "clause", "description": "Collector output is attributed to parsed command clauses."},
    "status_model": {"const": "call_granular_v1", "description": "Execution-status attribution model used by this artifact."},
    "telemetry_quality": {"enum": ["ok", "invalid", "unavailable"], "description": "Artifact-wide telemetry quality after loss, cleanup, and per-call checks."},
    "collection_validity": {"enum": ["valid", "invalid"], "description": "Whether the artifact passed collector integrity validation."},
    "calls": {
      "type": "array",
      "items": {"$ref": "#/$defs/call"},
      "description": "Per-tool-call clause telemetry records."
    }
  },
  "additionalProperties": true,
  "$defs": {
    "rssProvenance": {
      "type": "object",
      "properties": {
        "merged_rss_reason": {
          "type": "string",
          "description": "ok for a dense aligned sampled estimate, observed_sparse_lower_bound for an available conservative single-address-space observation, or the reason RSS is unavailable. Kernel RSS counter approximation still applies."
        },
        "memory_reduction": {
          "enum": ["max_observed_single_mm", "sum_aligned_distinct_live_mm_then_max"],
          "description": "Sparse coverage uses the largest actually observed single address-space value without temporal interpolation or asynchronous summation. Dense coverage retains the aligned held-sample aggregate."
        }
      },
      "additionalProperties": true
    },
    "clauseStatus": {
      "type": "object",
      "required": ["state", "exit_code", "signal", "succeeded", "reason", "source"],
      "properties": {
        "state": {
          "enum": ["exited", "signaled", "not_executed", "exec_failed", "unavailable"],
          "description": "Observed execution outcome for this clause."
        },
        "exit_code": {"type": ["integer", "null"], "description": "Process exit code when state is exited."},
        "signal": {"type": ["integer", "null"], "minimum": 1, "description": "Terminating signal number when state is signaled."},
        "succeeded": {"type": ["boolean", "null"], "description": "Normalized success result, or null when no reliable result exists."},
        "reason": {"type": ["string", "null"], "description": "Why execution status is missing, unavailable, or nonstandard."},
        "source": {
          "enum": [
            "root_exec_chain_terminal",
            "explicit_no_runtime_evidence",
            "live_shell_exit_code",
            "source_replay_exit_code"
          ],
          "description": "Evidence source used to determine clause status."
        }
      },
      "additionalProperties": false
    },
    "clause": {
      "type": "object",
      "required": ["bin", "argv", "ts_start", "ts_end", "latency_ms", "status"],
      "properties": {
        "bin": {"type": "string", "minLength": 1, "description": "Normalized executable or shell builtin name."},
        "argv": {
          "type": "array",
          "minItems": 1,
          "items": {"type": "string"},
          "description": "Parsed argument vector for the clause."
        },
        "ts_start": {"type": "number", "description": "Clause start as Unix seconds."},
        "ts_end": {"type": "number", "description": "Clause end as Unix seconds."},
        "latency_ms": {"type": ["number", "null"], "minimum": 0, "description": "Clause wall-clock latency in milliseconds."},
        "censored": {"type": "boolean", "description": "The execution ended before ordinary completion. Partial measurements remain available for learning; this flag records their outcome quality."},
        "confirmed_timeout": {"type": "boolean", "description": "Explicit timeout evidence, separate from an unclassified signal or cancellation."},
        "stdin_from_pipe": {"type": ["boolean", "null"], "description": "Optional evidence that stdin comes from the upstream pipe. Absent or null means unknown; downstream position alone is insufficient."},
        "status": {"$ref": "#/$defs/clauseStatus", "description": "Clause execution outcome and its evidence source."},
        "cpu_ns_cumulative": {
          "type": ["integer", "null"],
          "minimum": 0,
          "description": "Cumulative CPU time for the clause in nanoseconds (the collector's raw key)."
        },
        "cumulative_cpu_s": {
          "type": ["number", "null"],
          "minimum": 0,
          "description": "Human-readable seconds form of cpu_ns_cumulative (cpu_ns_cumulative / 1e9)."
        },
        "peak_cpu_cores": {"type": ["number", "null"], "minimum": 0, "description": "Maximum fixed-window CPU utilization in cores when eligible."},
        "peak_memory_mb": {"type": ["number", "null"], "minimum": 0, "description": "Sampled process-lineage RSS in decimal megabytes; sparse coverage reports the largest observed single address-space value as a conservative lower bound, with reduction and quality in provenance."},
        "provenance": {"$ref": "#/$defs/rssProvenance", "description": "Measurement and mapping evidence, including the RSS reduction and coverage quality."},
        "disk_read_bytes": {"type": ["integer", "null"], "minimum": 0, "description": "Attributed task I/O read-byte delta."},
        "disk_write_bytes": {"type": ["integer", "null"], "minimum": 0, "description": "Attributed task I/O write-byte delta."},
        "network_rx_bytes": {"type": ["integer", "null"], "minimum": 0, "description": "Attributed received bytes; currently null because clause network collection is not implemented."},
        "network_tx_bytes": {"type": ["integer", "null"], "minimum": 0, "description": "Attributed transmitted bytes; currently null because clause network collection is not implemented."},
        "availability": {
          "type": ["object", "null"],
          "additionalProperties": true,
          "description": "Per-target quality reasons. Stable target keys are latency, cpu_time, cpu, memory, disk_io, and status; diagnostic details may expand. Partial numeric observations are retained even when timeout or incomplete mapping makes quality unknown."
        }
      },
      "additionalProperties": true
    },
    "noRuntimeExec": {
      "type": "object",
      "required": ["bin", "argv", "status"],
      "properties": {
        "bin": {"type": "string", "minLength": 1, "description": "Parsed executable or builtin that produced no runtime exec image."},
        "argv": {
          "type": "array",
          "minItems": 1,
          "items": {"type": "string"},
          "description": "Parsed arguments for the non-executed clause."
        },
        "status": {"$ref": "#/$defs/clauseStatus", "description": "Evidence explaining why the clause did not execute."}
      },
      "additionalProperties": true
    },
    "callResource": {
      "type": "object",
      "required": ["peak_cpu_cores", "sampled_peak_rss_mb", "availability"],
      "properties": {
        "peak_cpu_cores": {"type": ["number", "null"], "minimum": 0, "description": "Maximum CPU utilization in cores after summing all owned exec-image contributions in aligned 500 ms windows."},
        "sampled_peak_rss_mb": {"type": ["number", "null"], "minimum": 0, "description": "Dense sampled RSS is summed across distinct live address spaces in aligned bins. Sparse coverage reports the largest observed single address-space value as a conservative lower bound. Units are decimal megabytes; provenance identifies the reduction."},
        "provenance": {"$ref": "#/$defs/rssProvenance", "description": "Call-level reduction evidence, including RSS coverage quality."},
        "availability": {
          "type": "object",
          "description": "Per-target quality of the call-level CPU and sampled RSS peaks. Timeout and incomplete mapping preserve already observed numeric values alongside an unknown:<reason> diagnostic; a null value means the metric itself is missing.",
          "required": ["cpu", "memory"],
          "properties": {
            "cpu": {"type": "string", "description": "ok or an unknown:<reason> value for the call-level CPU peak."},
            "memory": {"type": "string", "description": "ok or an unknown:<reason> value for the call-level RSS peak."}
          },
          "additionalProperties": false
        }
      },
      "additionalProperties": true
    },
    "call": {
      "type": "object",
      "required": [
        "tool_call_id",
        "command",
        "telemetry_quality",
        "eligible_for_kb",
        "clauses"
      ],
      "properties": {
        "tool_call_id": {"type": "string", "minLength": 1, "description": "OpenClaw tool-call identifier."},
        "command": {"type": "string", "description": "Original command associated with this telemetry record."},
        "telemetry_quality": {"enum": ["ok", "invalid", "unavailable"], "description": "Quality of this call's mapping and measurements."},
        "eligible_for_kb": {"type": "boolean", "description": "Collector completeness diagnostic retained for compatibility. The shared ingestion policy retains observed partial measurements and zero-fills missing metrics rather than discarding this call solely on this flag."},
        "censored": {"type": "boolean", "description": "The execution ended before ordinary completion. Observed partial values remain usable and the outcome is retained as provenance."},
        "confirmed_timeout": {"type": "boolean", "description": "Explicit timeout evidence; an arbitrary signal or cancellation alone does not establish a timeout threshold."},
        "timeout_duration_lower_bound_ms": {"type": ["number", "null"], "minimum": 0, "description": "Confirmed tool-execution timeout lower bound in milliseconds, when available. This is not an unrelated setup or whole-benchmark time budget."},
        "call_resource": {"$ref": "#/$defs/callResource", "description": "Call-level peak metrics reduced from aligned profiles across all mapped exec images."},
        "clauses": {
          "type": "array",
          "items": {"$ref": "#/$defs/clause"},
          "description": "Mapped runtime clause measurements."
        },
        "no_runtime_exec": {
          "type": "array",
          "items": {"$ref": "#/$defs/noRuntimeExec"},
          "description": "Parsed clauses proven not to have produced a runtime exec image."
        }
      },
      "additionalProperties": true
    }
  }
}
