{
  "schema": "clause_telemetry_v2",
  "version": 2,
  "mode": "clause",
  "status_model": "call_granular_v1",
  "telemetry_quality": "ok",
  "collection_validity": "valid",
  "calls": [
    {
      "tool_call_id": "call-example",
      "command": "printf hello",
      "telemetry_quality": "ok",
      "eligible_for_kb": true,
      "clauses": [
        {
          "bin": "printf",
          "argv": ["printf", "hello"],
          "ts_start": 1000.0,
          "ts_end": 1000.01,
          "latency_ms": 10.0,
          "status": {
            "state": "exited",
            "exit_code": 0,
            "signal": null,
            "succeeded": true,
            "reason": null,
            "source": "root_exec_chain_terminal"
          }
        }
      ],
      "no_runtime_exec": []
    }
  ]
}
